{
  "$schema": "https://json-schema.org/draft/2020-12/schema",
  "$id": "https://auditspec.dev/profiles/agent/0.1/schema.json",
  "title": "AuditSpec Agent Profile v0.1",
  "type": "object",
  "additionalProperties": false,
  "minProperties": 1,
  "properties": {
    "provider": { "type": "string", "minLength": 1 },
    "model": { "type": "string", "minLength": 1 },
    "agent_version": { "type": "string", "minLength": 1 },
    "runtime": { "$ref": "#/$defs/runtime" },
    "parent_agent": { "$ref": "#/$defs/agentRef" },
    "tool": { "$ref": "#/$defs/tool" },
    "approval": { "$ref": "#/$defs/approval" },
    "prompt": { "$ref": "#/$defs/contentRef" },
    "input": { "$ref": "#/$defs/contentRef" },
    "output": { "$ref": "#/$defs/contentRef" },
    "tokens": { "$ref": "#/$defs/tokens" }
  },
  "$defs": {
    "digest": {
      "type": "object",
      "additionalProperties": false,
      "required": ["algorithm", "value"],
      "properties": {
        "algorithm": { "type": "string", "minLength": 1 },
        "value": { "type": "string", "minLength": 1 }
      }
    },
    "contentRef": {
      "type": "object",
      "additionalProperties": false,
      "required": ["digest"],
      "properties": {
        "digest": { "$ref": "#/$defs/digest" },
        "preview": { "type": "string", "maxLength": 512 },
        "media_type": { "type": "string", "minLength": 1 },
        "size_bytes": { "type": "integer", "minimum": 0 }
      }
    },
    "runtime": {
      "type": "object",
      "additionalProperties": false,
      "required": ["name"],
      "properties": {
        "name": { "type": "string", "minLength": 1 },
        "version": { "type": "string", "minLength": 1 },
        "environment": { "type": "string", "minLength": 1 }
      }
    },
    "agentRef": {
      "type": "object",
      "additionalProperties": false,
      "required": ["type", "id"],
      "properties": {
        "type": { "const": "agent" },
        "id": { "type": "string", "minLength": 1 }
      }
    },
    "tool": {
      "type": "object",
      "additionalProperties": false,
      "required": ["name"],
      "properties": {
        "name": { "type": "string", "minLength": 1 },
        "kind": { "type": "string", "minLength": 1 },
        "server": { "type": "string", "minLength": 1 },
        "version": { "type": "string", "minLength": 1 }
      }
    },
    "principal": {
      "type": "object",
      "additionalProperties": false,
      "required": ["type", "id"],
      "properties": {
        "type": { "type": "string", "minLength": 1 },
        "id": { "type": "string", "minLength": 1 }
      }
    },
    "approval": {
      "type": "object",
      "additionalProperties": false,
      "required": ["required", "status"],
      "properties": {
        "required": { "type": "boolean" },
        "status": {
          "enum": ["not_required", "requested", "approved", "denied", "expired", "unknown"]
        },
        "principal": { "$ref": "#/$defs/principal" },
        "policy": { "type": "string", "minLength": 1 },
        "reason": { "type": "string", "minLength": 1 }
      }
    },
    "tokens": {
      "type": "object",
      "additionalProperties": false,
      "properties": {
        "input": { "type": "integer", "minimum": 0 },
        "output": { "type": "integer", "minimum": 0 },
        "total": { "type": "integer", "minimum": 0 }
      },
      "minProperties": 1
    }
  }
}
